mysql> show databases
    -> ;
+-----------------------------+
| Database                    |
+-----------------------------+
| company                     |
| dbms                        |
| expense_management          |
| expense_management_20_april |
| expense_management_26_april |
| expense_management_27_april |
| information_schema          |
| joins                       |
| library_management          |
| manager                     |
| mysql                       |
| performance_schema          |
| product_management          |
| product_management1         |
| product_management2         |
| product_management4         |
| product_service             |
| sakila                      |
| school_management_system    |
| student                     |
| sys                         |
| user_service                |
| visitor_management          |
| world                       |
+-----------------------------+
24 rows in set (0.00 sec)

mysql> ^Screate database ddl;
ERROR 1064 (42000): You have an error in your SQL syntax; check the manual that corresponds to your MySQL server version for the right syntax to use near '‼create database ddl' at line 1
mysql> create database ddl;
ERROR 1007 (HY000): Can't create database 'ddl'; database exists
mysql> show databases;
+-----------------------------+
| Database                    |
+-----------------------------+
| company                     |
| dbms                        |
| ddl                         |
| expense_management          |
| expense_management_20_april |
| expense_management_26_april |
| expense_management_27_april |
| information_schema          |
| joins                       |
| library_management          |
| manager                     |
| mysql                       |
| performance_schema          |
| product_management          |
| product_management1         |
| product_management2         |
| product_management4         |
| product_service             |
| sakila                      |
| school_management_system    |
| student                     |
| sys                         |
| user_service                |
| visitor_management          |
| world                       |
+-----------------------------+
25 rows in set (0.00 sec)

mysql> use ddl;
Database changed
mysql> show tables;
Empty set (0.00 sec)

mysql> create table student(
    -> roll_no int,name varchar(60),marks int,mobileNo varchar(40));
Query OK, 0 rows affected (0.07 sec)

mysql> desc student;
+----------+-------------+------+-----+---------+-------+
| Field    | Type        | Null | Key | Default | Extra |
+----------+-------------+------+-----+---------+-------+
| roll_no  | int         | YES  |     | NULL    |       |
| name     | varchar(60) | YES  |     | NULL    |       |
| marks    | int         | YES  |     | NULL    |       |
| mobileNo | varchar(40) | YES  |     | NULL    |       |
+----------+-------------+------+-----+---------+-------+
4 rows in set (0.00 sec)

mysql> insert into student values(1,'gaurav',80,'7020611722'),(2,'sagar',90,'1020304050'),(3,'sanket',95,'20303030203');
Query OK, 3 rows affected (0.02 sec)
Records: 3  Duplicates: 0  Warnings: 0

mysql> select * from student;
+---------+--------+-------+-------------+
| roll_no | name   | marks | mobileNo    |
+---------+--------+-------+-------------+
|       1 | gaurav |    80 | 7020611722  |
|       2 | sagar  |    90 | 1020304050  |
|       3 | sanket |    95 | 20303030203 |
+---------+--------+-------+-------------+
3 rows in set (0.00 sec)

mysql> select name,marks from student;
+--------+-------+
| name   | marks |
+--------+-------+
| gaurav |    80 |
| sagar  |    90 |
| sanket |    95 |
+--------+-------+
3 rows in set (0.00 sec)

mysql> alter table student add subject varchar(50);
Query OK, 0 rows affected (0.03 sec)
Records: 0  Duplicates: 0  Warnings: 0

mysql> desc student;
+----------+-------------+------+-----+---------+-------+
| Field    | Type        | Null | Key | Default | Extra |
+----------+-------------+------+-----+---------+-------+
| roll_no  | int         | YES  |     | NULL    |       |
| name     | varchar(60) | YES  |     | NULL    |       |
| marks    | int         | YES  |     | NULL    |       |
| mobileNo | varchar(40) | YES  |     | NULL    |       |
| subject  | varchar(50) | YES  |     | NULL    |       |
+----------+-------------+------+-----+---------+-------+
5 rows in set (0.00 sec)

mysql> select * from student;
+---------+--------+-------+-------------+---------+
| roll_no | name   | marks | mobileNo    | subject |
+---------+--------+-------+-------------+---------+
|       1 | gaurav |    80 | 7020611722  | NULL    |
|       2 | sagar  |    90 | 1020304050  | NULL    |
|       3 | sanket |    95 | 20303030203 | NULL    |
+---------+--------+-------+-------------+---------+
3 rows in set (0.00 sec)

mysql> update table student set subject='maths' where roll_no=1;
ERROR 1064 (42000): You have an error in your SQL syntax; check the manual that corresponds to your MySQL server version for the right syntax to use near 'table student set subject='maths' where roll_no=1' at line 1
mysql> update student set subject='maths' where roll_no=1;
Query OK, 1 row affected (0.01 sec)
Rows matched: 1  Changed: 1  Warnings: 0

mysql> select * from student;
+---------+--------+-------+-------------+---------+
| roll_no | name   | marks | mobileNo    | subject |
+---------+--------+-------+-------------+---------+
|       1 | gaurav |    80 | 7020611722  | maths   |
|       2 | sagar  |    90 | 1020304050  | NULL    |
|       3 | sanket |    95 | 20303030203 | NULL    |
+---------+--------+-------+-------------+---------+
3 rows in set (0.00 sec)

mysql> rename table student to school;
Query OK, 0 rows affected (0.02 sec)

mysql> select * from school;
+---------+--------+-------+-------------+---------+
| roll_no | name   | marks | mobileNo    | subject |
+---------+--------+-------+-------------+---------+
|       1 | gaurav |    80 | 7020611722  | maths   |
|       2 | sagar  |    90 | 1020304050  | NULL    |
|       3 | sanket |    95 | 20303030203 | NULL    |
+---------+--------+-------+-------------+---------+
3 rows in set (0.01 sec)

mysql> truncate table school;
Query OK, 0 rows affected (0.03 sec)

mysql> select * from school;
Empty set (0.00 sec)

mysql>